{
  "version": "3.0.0",
  "package": "com.example.app",
  "captured_at": "2026-09-15T12:00:00Z",
  "activities": [
    {
      "name": "com.example.app.ProfileActivity",
      "visit_count": 2,
      "widgets": [
        {
          "resource_id": null,
          "text": null,
          "content_desc": null,
          "path": "android.widget.RelativeLayout/android.widget.CheckBox"
        },
        {
          "resource_id": null,
          "text": null,
          "content_desc": "Share",
          "path": "android.widget.FrameLayout/android.widget.ImageButton"
        }
      ]
    }
  ]
}
